id,sent1,sent2,label,annotation1,annotation2
57,"The broad Standard & Poor's 500 Index .SPX gained 22.25 points, or 2.23 percent, to 1,018.22, based on the latest available figures.","The broad Standard & Poor's 500 Index .SPX gained 11.22 points, or 1.13 percent, at 1,007.19.",1,"Depends (Correct) - difference between annotation and system analysis   If you remove all the numbers, then yeah these are direct paraphrases.  But the system doesn't do that and so sees a big difference, which is the correct thing to do.  Under the MSRP annotation guidelines these are paraphrases, but if numbers were not xxx'd out, then it wouldn't be a paraphrase.",not a paraphrase; numbers do not match;
58,Aiken's study appears in the Sept. 24 issue of the Journal of the American Medical Association.,The findings appear in Wednesday's Journal of the American Medical Association.,1,Correct  System gets this wrong because this requires a lot of inference:  Aiken;s study --> findings Sep 24 issue --> Wed issue,anaphoric reference;
59,"""The integration is exceeding almost every expectation we set for ourselves,"" Mr Roberts said on Thursday.","It's manageable, and the integration is exceeding ""almost every expectation we set for ourselves.""",0,"Correct  I guess if we call removing the attribution as changing the meaning, then yes MSRP is correct, though the underlying statement is semantically equivalent.",A contains the speaker and time; matching quotations;
60,"He urged Congress to ""send me the final bill as soon as possible so that I can sign it into law.""","""I urge Congress to quickly resolve any differences and send me the final bill as soon as possible so that I can sign it into law,"" he said.",0,Incorrect  I think this is pretty much the same thing.  The resolve differences phrase shouldnt make that much of a difference.  System will mark as a paraphrase because a majority of the text is the same.,arguably a paraphrase; 0 -> quickly resolve any differences;
61,They certainly reveal a very close relationship between Boeing and senior Washington officials.,The e-mails reveal the close relationship between Boeing and the Air Force.,1,CORRECT  anaphora: they --> emails named entity: Washington officials --> Air Force,A is more specific; anaphoric reference; senior Washington officials -> the Air Force;
62,The leading actress nod went to energetic newcomer Marissa Jaret Winokur as Edna's daughter Tracy.,"Marissa Jaret Winokur, as Tracy, won for best actress in a musical.",1,"Correct  Lots of difficult transformations for a system.  ""leading actress nod"" --> ""won for best actress""  for example.",leading actress nod went to -> won for best actress in a musical;
63,Tennessee Titans quarterback Steve McNair apologized Thursday for his arrest hours earlier in Nashville on suspicion of drunken driving and illegal possession of a handgun.,Tennessee Titans quarterback Steve McNair was arrested Thursday and charged with drunken driving and possession of a handgun.,0,"Correct  One is about the apology, the other is about the act.  Lot of words in overlap, but subtle difference that may be hard for a system to get.",apologized for -> 0; A entails B;
64,"Federal and local officials, including Bush, saw no apparent sign of terrorism.",Federal officials earlier said there is no evidence of terrorism.,1,"Correct  Some minor differences: ""local officials"" is dropped and ""including Bush"" is dropped.  So the original sentence subsumes the second.",short sentence; including Bush -> 0; no apparent sign -> no evidence;
65,"Security experts are warning that a new mass-mailing worm is spreading widely across the Internet, sometimes posing as e-mail from the Microsoft founder.","A new worm has been spreading rapidly across the Internet, sometimes pretending to be an e-mail from Microsoft Chairman Bill Gates, antivirus vendors said Monday.",1,"Correct  Lots of transformations - inclusion of security experts, mass-mailing, widely --> rapidly, pretending --> posing, founder --> Bill Gates.  security-experts --> antivirus vendors.  probably all these transformations nudge the classifier from calling this paraphrase.",Security experts -> antivirus vendors (requires world knowledge); posing as -> pretending to be; word order;
66,Others keep records sealed for as little as five years or as much as 30.,Some states make them available immediately; others keep them sealed for as much as 30 years.,0,Borderline...but I guess incorrect since who knows if others = states (though the anaphora issue was waived for other examples I saw).  But little as five years vs. immediately is a big difference.  Much of the sentences are similar except for these few words so I can see how the system can call it paraphrase,as little as five years -> 0; 0 -> make them available immediately;
67,"Scrimshaw, Supervisor, Best Minister and Ten Most Wanted are expected to complete the Belmont field.","Best Minister, Scrimshaw, and Ten Most Wanted all had workouts on Monday morning.",0,Correct  s1 is about who will be competing and s2 is about the fact they had workouts.  The sentences are short so the names in the first half push things over the edge for the system?,??
68,"""Tomorrow at the Mission Inn, I have the opportunity to congratulate the governor-elect of the great state of California.","""I have the opportunity to congratulate the governor-elect of the great state of California, and I'm looking forward to it.""",0,Borderline  I could go either way on this one - correct or incorrect.  I can see how a system would call this a paraphrase since 2/3 of the sentence is almost exactly the same.,Tomorrow at the Mission Inn -> 0; 0 -> and I'm looking forward to it;
69,Prosecutors did an about-face in May and asked that the autopsy reports be unsealed after portions of Conner Peterson's autopsy report favorable to the defense were leaked to the media.,They asked that the autopsy reports be unsealed after portions of the autopsy report on Peterson's unborn son that were favorable to the defense were leaked to the media.,0,Not sure  I guess the differene is the about-face part in the beginning?  Everything else is really the same...,anaphoric reference; did an about-face in May -> 0; Conner Peterson -> Peterson's unborn son;
70,"The other 24 members are split between representatives of the securities industry and so-called ""public"" board members.","Of the 24 directors who are not exchange executives, half are representatives of the securities industry and half are designated public members.",1,Correct  Difficult transformations with half and split.,split between -> half are ... and half are; who are not exchange executives -> 0;
71,"The women said those rape victims who did come forward were routinely punished for minor infractions while their assailants escaped judgement, prompting most victims to remain silent.",The women said victims of rape who came forward routinely were punished for minor infractions while their assailants escaped judgment.,0,Correct  s2 misses the causality part...it's like the first part sets up the second.  Too much material overlap otherwise.,B contains less than A; prompting most victims to remain silent -> 0;
72,"In recent years, Hampton kept in touch with friends and stayed in trouble: He faced charges of fare-beating and credit card theft.","In recent years, Mr. Hampton continued to run into trouble, facing charges of fare-beating and credit-card theft.",0,"Incorrect  I think kept in touch with friends isn't that big of a deal, unless it is implied that these friends kept him in trouble, but would really need the context to figure this out.  I think under the circumstances it's ok for the system to mark this as a paraphrase.",kept in touch with friends -> 0;
73,"Besides Hampton and Newport News, the grant funds water testing in Yorktown, King George County, Norfolk and Virginia Beach.","The grant also funds beach testing in King George County, Norfolk and Virginia Beach.",0,Correct  I am guessing there is a difference between water testing (s1) and beach testing (s2).  System thinks this is a paraphrase because last half is basically the same save for that one water --> beach transformation.,probably should be judged a paraphrase by overlap criterion; Besides Hampton and Newport News -> 0;
74,"""Our strong preference is to achieve a financial restructuring out of court, and we remain hopeful we can do so,"" chief executive Marce Fuller said.","""Our strong preference is to achieve a financial restructuring out of court,"" Mirant CEO Marce Fuller said in a prepared statement early Friday.",0,"Incorrect  These seem pretty similar - main part of the quote is exactly the same, attribution is the same, conjunction of ""and we remain hopeful we can do so"" doesn't change much for me.",matching quotations; and we remain hopeful we can do so -> 0; 0 -> in a prepared statement early Friday;
75,Police using pepper spray arrested 12 people Monday night at a march and rally by about 400 activists protesting an annual training seminar of the Law Enforcement Intelligence Unit.,Police used pepper spray and rubber bullets to disperse a downtown march and rally last night by activists protesting an annual police intelligence-training seminar.,0,"Correct  Meaning difference - this is subtle for a machien to get - s1 seems to be more about the arresting of 12 people, while s2 is about the dispersing of the crowd.  Talking about the same event but different spins on it.  So a lot of the words are of course overlapping, but not semantically equivalent.",A contains more details;
76,"Penn Traffic's stock closed at 36 cents per share on Wednesday on Nasdaq, up two cents.","Penn Traffic stock closed Wednesday at 36 cents, up 2 cents, or 6.2 percent, from Tuesday's close.",0,Incorrect  Numbers are all right and dates are all right but the system marks this as a paraphrase which I think is totally fine.  Not sure why humans marked this as not a paraphase,"probably a paraphrase; 0 -> or 6.2 percent, from Tuesday's close;"
77,"During the hearing, Morales expressed ""sincere regrets and remorse"" for his actions.","Morales, who pleaded guilty in July, expressed ""sincere regret and remorse"" for his crimes.",0,Incorrect  Information differences don't seem to really change semantic content.,B contains more than A; 0 -> who pleaded guilty in July;
78,"The report forecasts there will be 71,079 hot spots worldwide this year, up from just 14,752 in 2002 and 1,214 in 2001.","The report also claims that there will be up to 9.3 million visitors to hot spots this year, up again from the meagre 2.5 million in 2002.",0,"Correct  Not sure why system gets this as a paraphrase, the number are all off, though the basic sentence template is pretty similar.","the numbers differ; and 1,214 in 2001 -> 0;"
79,The Episcopal Diocese of Central Florida became one of the first in the nation Saturday to officially reject the national denomination's policies on homosexuality.,The Episcopal Diocese of Central Florida voted Saturday to repudiate a decision by the denomination's national convention to confirm a gay man as bishop.,1,Incorrect  I think s1 is more general than s2's specific repudiation claim.  I think system is right to call this non-para.,one of the first in the nation -> 0; officially reject -> vote to repudiate; policies homosexuality -> a gay man as bishop (requires general knowledge);
80,"Russian stocks fell after the arrest last Saturday of Mikhail Khodorkovsky, chief executive of Yukos Oil, on charges of fraud and tax evasion.","The weekend arrest of Russia's richest man, Mikhail Khodorkovsky, chief executive of oil major YUKOS, on charges of fraud and tax evasion unnerved financial markets.",0,"Incorrect?  I think we could easily find examples where inference would link fragments like ""russian stocks fell"" to ""unnerved financial markets"".  I think the system marking this as a paraphrase is fine.",arguably a paraphrase; Russian stocks fell after -> unnerved financial markets;
81,Ohio Attorney General Jim Petro hailed the appellate court ruling.,"Ohio Attorney General Jim Petro was pleased by the ruling, spokesman Mark Gribben said.",1,Correct ??  Again the attribution difference is ignored.  have to inference that the ac ruling in s1 is the ruling in s2.,hailed -> was pleased by; appellate court -> 0; 0 -> spokesman Mark Gribben said;
82,"Anything less is unacceptable,"" said Gordon, the ranking Democrat on the House Space and Aeronautics subcommittee.",Gordon is the senior Democrat on the House Subcommittee on Space and Aeronautics.,0,"Correct  System is way off here.   The gist of s1 is what Gordon said, which isn't in s2 ""Anything less is unacceptable""   But there is a majority of other material there that is highly overlapped to overrule the four words not in s2.","B is missing a quotation; Anything less is unacceptable,"" said Gordon -> 0;"
83,Wal-Mart estimates more than 100 million Americans visit their stores every week.,"Each week 138 million shoppers visit Wal-Mart's 4,750 stores.",1,Correct  Tough inference and sentence transformation.  more than 100mil ~ 138 mil for example.,not a paraphrase; Americans -> shoppers; numbers do not match;
84,The work appears in the Oct. 22/29 issue of the Journal of the American Medical Association.,The study appears in Wednesday's Journal of the American Medical Association (news - web sites).,1,"Correct (reduced number issue)  I guess Oct 22/29 --> wed is reduced for the humans, but not for the system.",work -> study; Oct. 22/29 issue -> Wednesday's;
85,"On May 1, he crawled through a narrow, winding canyon, rappelled down a 60-foot cliff and walked some six miles down the canyon.","He crawled through a narrow, winding canyon, rappelled down a 60-foot cliff, and walked some six miles down the canyon near Canyonlands National Park in southeastern Utah.",0,Incorrect  I feel this is a paraphrase: throw out the date and the exact location and everything is exactly the same.,arguably a paraphrase; B contains more detailed description; 0 -> near Canyonlands National Park in southeastern Utah;
86,"""In so many different ways, the artistry of black musicians has conveyed the experience of black Americans throughout our history,"" Bush said.","Surrounded by singers from Harlem, Bush said: ''The artistry of black musicians has conveyed the experience of black Americans throughout our history.",0,"Incorrect  I think this is ok, the other information doesn't add so much...",probably should be considered paraphrase; In so many different ways -> 0; 0 -> Surrounded by singers from Harlem
87,"The new analysis found that 32 of the 16,608 participants developed ovarian cancer during about 5 years of follow-up.","The new analysis found that 32 of 16,608 participants developed ovarian cancer in about 5 1/2 years of follow-up, including 20 women taking hormones.",0,"Incorrect  Subsumption - s2 adds 20 women taking hormones, but that doesn't change the meaning too much for me....well could go either way.  gray area.",B has more information than A; 0 -> including 20 women taking hormones;
88,Both are being held in the Armstrong County Jail.,Tatar was being held without bail in Armstrong County Prison today.,0,"Correct  Surprised that the system gets this right.  I guess the sentences are so short and ""<be> being held in Armstrong Country Jail/Prison"" outweighs the other changes?",very short sentence; Both -> Tatar; 0 -> without bail;
89,The Herald reported on Tuesday that internet developer Bruce Simpson was building a missile from parts ordered over the internet and shipped through Customs.,A home handyman is building a missile in his garage with parts bought over the internet and shipped through Customs.,1,"Correct  The first half does not overlap, need inferencing to tie them together.",*not a paraphrase; internet developer Bruce Simpson -> A home handyman;
90,The women said victims of rape who came forward routinely were punished for minor infractions while their assailants escaped judgment.,"The women said victims of rape who came forward were routinely punished for minor infractions while their attackers escaped judgment, prompting most victims to remain silent.",0,"Correct  There seems to be this casaulty effect with s2's additional phrase, whcih s1 does not ahve.  System calls it paraphrase because 80% of this long sentence overlaps strongly.  So subtle meaning difference?",B contains more than A; prompting most victims to remain silent; [I've seen this sentence pair before]
91,"Navistar shares were down 44 cents, or 1.1 percent, at $41.19 on the New York Stock Exchange after falling as low as $39.93.",Navistar shares rose a penny to $41.64 at late afternoon on the New York Stock Exchange after earlier falling as low as $39.93.,0,"Correct  Not sure why we get this wrong, a bunch of the numbers are off.  But maybe enough is in common to push it over the edge.",numbers do not match; were down != rose;
92,"Lawmakers at the closed-door hearing focused on the National Intelligence Estimate reports on Iraq's chemical, biological and nuclear weapons programs.",Lawmakers on the House panel will question intelligence analysts at the closed-door hearing about the factors that went into compiling the National Intelligence Estimate reports on Iraq's weapons programs.,1,Incorrect  I feel these two are semantically different.  s1 focuses on stating what the lawmakers focus on.  s2 says specifically that they will question what they are focusing on.  Maybe I am splitting hairs too much on this.,"on the House panel will question intelligence analysts -> 0; chemical, biological and nuclear -> 0;"
93,The supercomputer is actually an eServer and storage system with a peak speed of 7.3 trillion calculations per second.,It's a cluster of 44 IBM servers with a peak speed of 7.3 trillion calculations per second.,1,"Correct  Anaphora - inferencing between ""supercomputer...storage system"" --> it  . This one is wicked hard for a system and requires massive amounts of world knowledge.",anaphoric reference; an eServer and storage system -> a cluster of 44 IBM servers;
94,The launch marks the start of a new golden age in Mars exploration.,The launch marks the start of a race to find life on another planet.,1,"Incorrect  I feel this should not be a paraphrase, a new golden age for Mars is a bit different from find life on another planet, I think there is some majoring inferencing going on.",not a paraphrase; new golden age in Mars exploration -> race to find life on another planet;
95,"""It would be completely irresponsible to reverse course and kill country-of-origin labeling,"" said Daschle.","""It would be completely irresponsible to reverse course,"" said Senate Democratic Leader Tom Daschle, of South Dakota.",0,Incorrect  extra information doesn't change meaning.  i think the system is right.,named entity recongition could match name in A to name + description in B; and kill country-of-origin labeling -> 0;
96,"Site Finder has been visited 65 million times since its introduction, Galvin said.","Through Sunday, Sept. 21, Site Finder has been visited over 65 million times by Internet users.",1,"Correct  Hard inference - have to know that the introduction = Sunday, Sep 21.  That's really hard for a system.",Galvin said -> 0; since its introduction -> since Sept. 21;
97,The case comes out of Illinois and involves a for-profit company called Telemarketing Associates Inc.,"The case decided Monday centered around an Illinois fund-raiser, Telemarketing Associates.",1,"Correct  I guess this is a paraphrase, the gist is that there is a case which involves an Illinois company called Telemarketing Associates so the different information in s1 and s2 doesn't really change that.  This is problematic for a system since the only things in common are a few words - case, TA, Illinois....",comes out of -> 0; for-profit company -> fund-raiser;
98,"Licensing revenue slid 21 percent, however, to $107.6 million.","License sales, a key measure of demand, fell 21 percent to $107.6 million.",1,"Correct  Not sure why system does not get this right.  Though numbers are matched, slid and fell are in different places and a key measure of demand is in the middle which s1 doesn't have.",B contains material not in A; 0 -> a key measure of demand;
99,"Mr Pollard said: ""This is a terrible personal tragedy and a shocking blow for James's family.","Nick Pollard, the head of Sky News said: ""This is a shocking blow for James's family.",0,"Incorrect  Subsumption - there is the missing material of ""terrible personal tragedy"" in s2, but for me, removing this doesn't change the overall semantics.",named entity recognition might help; 0 -> the head of Sky News; a terrible personal tragedy -> 0;
100,Higher courts have ruled that the tablets broke the constitutional separation of church and state.,The federal courts have ruled that the monument violates the constitutional ban against state-established religion.,1,Correct  Lots of transformations   higher courts --> federal courts tablets broke --> monument violates separation --> ban church/state --> state-established religion,tablets -> monument; broke ... separation of church and state -> violates ban against state-established religion;
