id,sent1,sent2,label,annotation1,annotation2
1,"""It was a little bit embarrassing the way we played in the first two games,"" Thomas said.","""We're in the Stanley Cup finals, and it was a little bit embarrassing the way we played in the first two games.",0,Correct  missing the attribution....but these cases seem borderline...,Thomas said -> 0; 0 -> We're in the Stanley Cup finals;
2,The commission estimated California lost $937 million to corporate tax shelters in 2001.,California's lost tax revenue was mostly due to international corporate tax shelters.,1,Correct  To me this is borderline correct.  We dont have the part about the commission estimating the loss.  but generally the meaning that it lost tax revenue to corp. tax shelters seems about the same.  some minor numerical deletions from s1 to s2.,A has more details; arguably not a paraphrase;
3,Board Chancellor Robert Bennett declined to comment on personnel matters Tuesday.,"Mr. Mills declined to comment yesterday, saying that he never discussed personnel matters.",1,Incorrect  Not sure how this is annotated as a paraphrase!  Robert Bennett != Mr. Mills,*not a paraphrase; different names;
4,The three grocery chains were relying on store managers and replacement workers to keep their stores open.,"The supermarket chains have used managers and replacement workers to keep their stores open, often at reduced hours.",0,"Incorreect  Seems semantically equivalent to me, save for the added information, but seems superfluous",*should be a paraphrase; 0 -> often at reduced hours;
5,"""We put a lot of effort and energy into improving our patching process, probably later than we should have and now we're just gaining incredible speed.","""We've put a lot of effort and energy into improving our patching progress, probably later than we should have.",0,Correct  Borderline - additional information makes this sentence seem cause and effect - like it is set up for that second clause.,A contains more than B; and now we're just gaining incredible speed -> 0;
6,"Benchmark Treasury 10-year notes gained 17/32, yielding 4.015 percent.","The benchmark 10-year note was recently down 17/32, to yield 4.067 percent.",0,"Correct  Meaning difference - s1 goes up, s2 goes down.  And numbers are off.",gained -> was ... down (opposite meaning);
7,"Pacific Northwest has more than 800 employees, and Wells Fargo has 2,400 in Washington.","It has 800 employees, compared with Wells Fargo's 2,400.",1,Correct  Due to anaphora (it) - which MT systems won't get right.,anaphoric reference;
8,"Every Thursday, a grains management committee meets in the Commission's agriculture directorate to decide the outcome of a weekly export tender.",A grains management committee normally meets each Thursday in the Commission's agriculture unit -- another target of Wednesday's raids -- to decide the outcome of a weekly export tender.,0,"Incorrect  This really should be marked as a paraphrase, just some crazy alternations.  Seems like the only difference is ""another target of Wednesday's raids"" but is that really changing the meaning that much?  OK re-reading this, I don't know, this seems borderline in the semantic equivelance case - not sure if this is really changing the meaning a whole lot.",A contains more than B; another target of Wednesday's raids -> 0;
9,"Several thousand 3rd Infantry troops, including the 3rd Brigade Combat Team based at Fort Benning in Columbus, began returning last week.","A few thousand troops, most from the division's 3rd Brigade Combat Team based at Fort Benning in Columbus, began returning last week, with flights continuing through Friday.",0,"Incorrect  Seems semantically equivalent to me, save for the added information, but seems superfluous",B contains more information than A; Several -> a few; 0 -> with flights continuing through Friday;
10,Kodak expects earnings of 5 cents to 25 cents a share in the quarter.,Analysts surveyed by Thomson First Call had expected Kodak to earn 68 cents a share for the quarter.,1,"Correct / Incorrect (generic tag reduction)  Under MSRP guidelines with the generic tags reduced, this is correct.  But system doesnt have reduction so it marks at as not a paraphrase, which would also be correct.",not a paraphrase; B contains more information; numbers do not match;
11,"Dewhurst's proposal calls for an abrupt end to the controversial ""Robin Hood"" plan for school finance.","The committee would propose a replacement for the ""Robin Hood"" school finance system.",1,"Incorrect  s1 has Dewhurst (one person), while s2 has a committee.  s1 says the proposal calls for an end to the plan while s2 proposes a replacement - that's semantically different to me.",Dewhurst's proposal > 0; calls for an abrupt end to -> would propose a replacement for;
12,"Added Mr. Prodi: ""Maybe, but the old age helps us to understand our strengths and our weakness.""","""Maybe, but the old age helps us to understand our strength and our weakness and the reality of the world.",0,"Correct  I guess if we call removing the attribution as changing the meaning, then yes MSRP is correct, though the underlying statement is semantically equivalent.",Added Mr. Prodi -> 0; 0 -> and the reality of the world;
13,"Police said the suspected Marriott suicide bomber was Asmar Latin Sani, 28, from the island of Sumatra.","A sibling also identified Sani, 28, who was from the island of Sumatra, police said.",0,"Correct  No mention about the suicide bomber.  System thinks it is a paraphase because of enough other words and phrases outside the ""suspected Marriott suicide bomber"" --- actualyl I am surprised that this is marked as paraphrase by the system, the sentences are kind of short.",not a paraphrase; the suspected Marriott suicide bomber -> 0;
14,"Bulger's brother is now on the agency's ''10 Most Wanted'' list, sought in connection with 21 murders.","Bulger's brother, a former FBI informant, is now on the law enforcement agency's ""10 Most Wanted"" list.",0,"Incorrect  I think the general gist of s1 and s2 are the same, the other information doesn't change things all that much?",A and B each have extra material; sought in connection with 21 murders -> 0; 0 -> a former FBI informant;
15,"The Food and Drug Administration rejected ImClone's 2001 application to sell Erbitux, citing shoddy research.","The U.S. Food and Drug Administration rejected ImClone's original application in December 2001, saying the trial had been sloppily conducted.",1,"Correct  surprised system doesn't get this, but shoddy research probably is hard to match with trial sloppily conducted (tough paraphrase)",not a paraphrase; shoddy research  != the trial had been sloppily conducted;
16,"To put it very simply, Antetonitrus is Brontosaurus's older brother, hence the name.","Antetonitrus was brontosaurus' older brother, hence the name.",1,Correct  Not sure why system gets this wrong.,"A has intro. adverbial; To put it very simply, -> 0;"
17,"Police believe Wilson shot Reynolds, then her mother once in the head before fatally turning the gun on herself.",Police believe Wilson then shot Jennie Mae Robinson once in the head before turning the gun on herself.,0,"Correct  s1 is about Reynolds + plus, s2 is only about the mom, so different facts represented.  I think system gets it right because there is so much word overlap...infact just Reynolds and then JMR are different.",different names; Reynolds -> Jennie Mae Robinson;
18,Stocks dipped lower Tuesday as investors opted to cash in profits from Monday's big rally despite a trio of reports suggesting modest improvement in the economy.,Wall Street moved tentatively higher Tuesday as investors weighed a trio of reports showing modest economic improvement against an urge to cash in profits from Monday's big rally.,0,"Correct  Lot of words in common but there is that difference between ""dipped lower"" and ""moved tentatively higher"" - semantic difference",*not a paraphrase (opposite in meaning); Stocks dipped lower -> Wall Street moved tentatively higher;
19,"""If we could do that throughout the world, we could end terrorism,"" he said.","This is a hospital that treats everybody as people, and if we could do that throughout the world, we could end terrorism.""",1,"Correct  Anaphora. I think s1's ""that"" refers to the first part of s2 but in a different sentence.  So yeah a paraphrase, but hard for a system to get right which looks as much overlapping material as possible.",was judged a paraphrase by their anaphora criterion; 0 -> This is a hospital that treats everybody as people;
20,"While waiting for a bomb squad to arrive, the bomb exploded, killing Wells.",The bomb exploded while authorities waited for a bomb squad to arrive.,0,Correct  missing key part - Killing Wells.  Lot of material the same.,probably should be judged a paraphrase by overlap criterion; killing Wells -> 0; short sentence;
21,"The bodies of some of the dead, pulled out from under the train, were laid out beside the tracks while emergency services brought in wooden coffins.","The bodies of many of the dead, pulled from under the partially derailed train, were laid out by the tracks awaiting identification.",0,"Correct  Lot of overlap in the first 2/3, but s1 is about wooden coffins, s2 is abou waiting identification.",emergency services brought in wooden coffins -> 0; 0 -> awaiting identification;
22,"Stripping out the extraordinary items, fourth-quarter earnings were 64 cents a share compared to 25 cents a share in the prior year.",Earnings were 59 cents a share for the three months ended May 25 compared with 15 cents a share a year earlier.,0,Correct  System was way off!  Not sure how it got this wrong.  Maybe small 3-gram sequences were enough to call it paraphrase?,numbers do not match;
23,"The House voted 425 to 2 to clear the bill, the first of 13 that Congress must pass each year to fund the federal government.",The bill is among the first of 13 that Congress must pass each year to fund the federal government.,0,"Incorrect  Information is the same - first of 13, Congrass pass, fund federal government.  The original sentence simply has the voting numbers.",A entails B; The House voted 425 to 2 to clear the bill -> 0;
24,A tropical storm rapidly developed in the Gulf of Mexico Sunday and was expected to hit somewhere along the Texas or Louisiana coasts by Monday night.,A tropical storm rapidly developed in the Gulf of Mexico on Sunday and could have hurricane-force winds when it hits land somewhere along the Louisiana coast Monday night.,0,"Correct  The meaning is slightly different - first sentence is about where the storm hits, the second one seems more about the caliber of the storm.",B has more information than A; 0 -> could have hurricane-force winds;
25,"Lacy's last column, filed from the hospital, appeared in Friday's editions.",Lacy's last column appeared in Friday's edition of The Afro.,0,"I don't know!  The system marks this as a paraphrase because of last column, appeared, friday, etc. But s1 has ""filed from the hospital and editions"" and s2 has ""The Afro""",short sentence; filed from the hospital -> 0;
26,"The victim, whose name was not released, underwent surgery at the hospital.","The wounded doctor, whose name was withheld, underwent surgery at the hospital for three gunshot wounds.",0,"Borderline / Correct  This is an anaphora issue...is the victim = the wounded doctor?  oterwise, the facts of name being withheld and undergoing surgery at the hospital are all the same except for three gunshot wounds.",anaphoric reference; 0 -> three gunshot wounds;
27,"The blue-chip Dow Jones industrial average .DJI added 38 points, or 0.42 percent, to 9,165.","The Dow Jones Industrial Average [$INDU] ended at session highs, gaining 64.64 points, or 0.7 percent, to 9,191.09.",1,"Incorrect (generic tag redution)  I don't think this is a paraphrase because s2 has a session high which s1 does not have.  Numbers are all off so system will not mark this as a paraphrase, which I think is correct.",not a paraphrase; numbers do not match;
28,"The military said it had killed 12 rebels and captured nine in the campaign so far, for the loss of six soldiers wounded.","The military said it had killed 16 rebels and captured nine in the campaign so far, with one soldier killed and six wounded.",0,"Correct  I am not sure why this is marked as not para byt the humans if the numbers are xx'd out.  But maybe the ""old soldier killed"" makes a difference?  System thinks it is a paraohrase - there is a ton in common.",numbers differ; 0 -> with one soldier killed;
29,"Richard Miller remained hospitalized after undergoing a liver transplant, but his wife has recovered.","Richard Miller, 57, survived a lifesaving liver transplant but remains hospitalized.",0,"Correct  Not sure about this one, but I feel this additional information - ""his wife has recovered"" is a bit heavier than additional information like dates or ages. ???",A has more information; remained hospitalized -> survived; but his wife has recovered -> 0;
30,"Expenses are expected to be approximately $2.3 billion, at the high end of the previous expectation of $2.2-to-$2.3 billion.","Spending on research and development is expected to be $4.4 billion for the year, compared with the previous expectation of $4.3 billion.",1,"Correct / Incorrect (generic tag reduction)  MSRP annotation is ""correct"" given the guidelines to ignore numbers.  But when numbers are included, the system says incorrect, which is right.",not a paraphrase; numbers are different; expenses -> Spending on research and development;
31,"Critics say the law violates civil liberties, something House Judiciary Committee Chairman James Sensenbrenner, R-Wis., says he is sensitive to.","House Judiciary Committee Chairman James Sensenbrenner, R-Wis., says he is sensitive to civil liberties complaints.",0,"Correct  s1 is about Sensenbrenner agreeing with critics, s2 is saying what he is sensitive to.  It's subtle but I think different enough.  A lot of the material is overlapping so system gets it wrong, tough.",A contains more than B; Critics say the law violates civil liberties;
32,"Gyorgy Heizler, head of the local disaster unit, said the coach had been carrying 38 passengers.","The head of the local disaster unit, Gyorgy Heizler, said the coach driver had failed to heed red stop lights.",0,"Correct  s1 is about specifying the number of passengers, s2 is about why the accident happened.  System sees the first half and then coach and that probably is enough overlap to push it over the edge.  The non-overlapping part makes all the difference in the semantics.",carrying 38 passengers -> 0; 0 -> failed to heed red stop lights;
33,"Get it all out,"" says Howard Davidowitz, chairman of Davidowitz & Associates, a national retail consulting firm based in New York City.","Innocent or not, ""she's damaged goods,"" said Howard Davidowitz, chairman of Davidowitz & Associates, a national retail consulting firm in New York.",0,Correct  quotes by Davidowitz are different.  But material describing his background dominate the sentence and system thinks it is a paraphrase.,*not a paraphrase; quoted material is different;
34,"The three men have pleaded not guilty and their lawyers have asked the High Court to dismiss the charges, saying the state has failed to present a solid case.","Defense lawyers asked the High Court to dismiss the charges, saying the state has failed to present a solid case.",0,"Correct  subtle - there is a lot of text in common, but that remaining but is subsumption",A contains more information; The three men have pleaded not guilty -> 0;
35,"""Americans don't cut and run, we have to see this misadventure through,"" she said.","She also pledged to bring peace to Iraq: ""Americans don't cut and run, we have to see this misadventure through.""",0,"Correct  important information issue with ""pledged to bring peace to iraq""",B contains more than A; She also pledged to bring peace to Iraq: -> 0
36,"Ultimately, she will earn more than the $900,000 that Kenny Perry got for winning the PGA Tour event.",But she'll earn more than the $900000 (about R7.5-million) Kenny Perry got for winning.,1,Correct  Not sure why system doesn't get this - inclusion of too much other material like R7.5mil and PGA tour event?  But this material doesn't change the meaning.,the PGA Tour event -> 0; 0 -> (about R7.5-million);
37,"""I had no direct interest and Craxi begged me to intervene because he believed the operation damaged the state,"" he told a packed courtroom during a 45-minute address.","""I had no direct interest, and Craxi begged me to intervene because he believed that the operation damaged the state,"" Mr. Berlusconi said.",0,"Incorrect  Anaphora with Berlusconi, and 45min address is superfluous.  Everything else is almost exactly the same.  System gets it right",A contains extra material about place and time; a packed courtroom during a 45-minute address -> 0;
38,"In two weeks, he'll probably send out Peace Rules in the Preakness.",Frankel said Peace Rules will run in the Preakness Stakes on May 17.,1,"Incorrect?  Not sure about this one, I think this requires lots of world knowledge to get right.  But there is a difference between sending out peace rules and sayign he will run.",in two weeks -> on May 17; send out -> will run (requires general knowledge);
39,The CGT warned of prolonged industrial action unless Raffarin agreed.,The large CGT union warned France of lengthy industrial action.,0,Correct  Missing semantic difference of unless Raffarin agreed.  Everything else pretty much the same so it trips up system.,short sentence; unless Raffarin agreed -> 0; 0 -> warned France;
40,"Last year, he made an unsuccessful bid for the Democratic nomination for governor.","He ran last year for the Democratic nomination for Texas governor, but lost the primary to multimillionaire Tony Sanchez.",1,"Correct  ?  Not sure if the Tony Sanchez information difference should make this semantically different, I guess the main point that he lost last year is maintained.  System doesn't call it paraphrase because",B contains more than A; 0 -> but lost the primary to multimillionaire Tony Sanchez;
41,"Lowe's, with about half as many stores, reported a 33 percent increase in third-quarter profit behind a 12 percent jump in same-store sales.",Home Depot reported a 22 percent jump in third-quarter profit behind a nearly 8 percent rise in same-store sales.,0,"Correct  Numbers AND store are wrong, but general template is the same - tripping up system.",names are different; Lowe's -> Home Depot; numbers do not match; with about half as many stores -> 0;
42,The daily Hurriyet said the raid aimed to foil a Turkish plot to kill an unnamed senior Iraqi official in Kirkuk.,"The daily Hurriyet said the raid aimed to foil a Turkish plot to kill an unnamed senior Iraqi Kurdish official in Kirkuk, but Gul has denied any Turkish plot.",0,Correct  s2 adds additional information (Causality),B subsumes A; 0 -> but Gul has denied any Turkish plot
43,He said the FDA was hoping Congress and the courts would bring clarity to the situation and some financial relief to consumers.,He said FDA hopes Congress and the courts will bring clarity to the situation and some financial relief to consumers - perhaps before the 2004 elections.,0,"Correct  I guess the date sort of makes it different?  But for the most part, the sentences are matched almost exactly save for that extra phrase.",B contains more than A; 0 -> perhaps before the 2004 elections;
44,"Of 24 million phoned-in votes, 50.28 percent were for Studdard, putting him 130,000 votes ahead of Aiken.","Of the 24 million phone votes cast, Studdard was only 130,000 votes ahead of Aiken.",0,"Incorrect  This seems borderline to me.  The content is the same, but not sure if the 50.28% is enough of a difference to knock it to non-paraphrase as originally annotated.",arguably a paraphrase; A contains more than B; 50.28 percent -> 0;
45,"This is America, my friends, and it should not happen here,"" he said to loud applause.","""This is America, my friends, and it should not happen here.""",0,Incorrect?  Missing the attribution?,an exact copy of a quotation; he said to loud applause -> 0;
46,"State Democratic Chairman Herman Farrell, who is also chairman of the state Assembly's Ways and Means Committee, seemed perfectly happy to make it a political fight.","State Democratic Chairman Herman Farrell, who is also chairman of the Assembly's Ways and Means Committee, supports the Legislature's budget plan.",0,Correct  Yeah there is enough intention difference here: perfectly happy to make it a political fight vs. supports Legislature's budget plan.  I think the programs get tripped up because there is such strong direct overlap in the first 66% of the sentence.,seemed perfectly happy to make it a political fight -> 0; 0 -> supports the Legislature's budget plan;
47,"Thirty-three of the 42 men had been arrested by Wednesday evening, said Daniel Bogden, U.S. attorney in Nevada.","Thirty-four of the men have been arrested and the others are being sought, US Attorney Daniel Bogden said yesterday.",0,"Correct  number of men are different, date is missing and others being sought are missing.  There are a lot of fragment overlaps, but subtle differences change the meaning.",33 -> 34; 42 -> 0; minor differences;
48,"Hilsenrath was also indicted on 33 counts of wire fraud, which each carry a maximum penalty of five years in prison, a $250,000 fine and restitution.","Each of those counts carries a maximum penalty of five years in prison and a $250,000 fine plus restitution.",0,"Correct  Yeah these are not semantically equivalent, I agree with annotation.  That first part is just not captured and actually makes a difference in the meaning I think, this one is tough for a system given all the other subsumption things it has to deal with.",A contains more than B; Hilsenrath was also indicted on 33 counts of wire fraud -> 0;
49,"The valid signatures of 897,158 registered California voters must be collected and turned in to county election officials by Sept. 2.","To force a recall election of Davis, the valid signatures of 897,158 registered California voters must be turned in to election officials.",0,"Incorrect  The date hasn't made a difference in other sentences, I feel this is really splitting hairs.",B contains more information than A;  0 -> To force a recall election of Davis;
50,"The Coast Guard airlifted the survivors to Bartlett Regional Hospital, Wetherell said.","Soon after, a Coast Guard helicopter landed and took the men to Bartlett Regional Hospital, Mills said.",1,Incorrect  This could be correct but the survivors --> men is a sort of tough inference for a system to make.  But the attribution is off...Wetherell is replaced by Mills.,airlifted -> helicopter landed and took; different names;
51,"And of those, 149, or 55%, ""claimed to treat, prevent, diagnose or cure specific diseases.""","And of those, 55 percent, or 149, claimed to treat, prevent, diagnose or cure specific diseases -- despite the regulations prohibiting that kind of statement.",0,"Correct  this is borderline for me, but I guess that second clause changes the semantics enough.  How come the MT metrics like this?  This is a lot of new material that is added to the sentence.",B contains information not in A; 0 -> despite the regulations prohibiting that kind of statement;
52,Several states and the federal government later passed similar or more strict bans.,"Following California's lead, several states and the federal government passed similar or tougher bans.",0,"Incorrect  Not sure why this is marked as not a paraphrase, seems ok with me.  Does California make that big of a difference?  Maybe this is the casaulity thing.",arguably a paraphrase; 0 -> Following California's lead;
53,I'm never going to forget this day.,"I am never going to forget this throughout my life.""",1,Incorrect  s2 doesn't have what should be forgotten.,short sentence; 0 -> throughout my life;
54,"The security official's backup couldn't fill in because he was on active military duty, Strutt said.","The security official's backup was on active duty, and the lottery association didn't have a replacement in New Jersey, Strutt said.",0,"Incorrect  This is like the Liza Minelli example on p.12 - some minor information added, but still counts as a paraphrase.  The information added here is the lottery association, which I bet could be found in another sentence in the original sentence's context.",B has more information than A; 0 -> and the lottery association didn't have a replacement in New Jersey;
55,These are real crimes that hurt a lot of people.,"""These are real crimes that disrupt the lives of real people,"" Smith said.",1,"Incorrect  This is an annotation inconsistency - in other examples if the attribution was not included, it would be marked as NotPara by the humans.  I guess the quote is more or less a paraphrase, though ""hurt a lot of people"" and ""disrupt lives..."" may be a tough para for a sytsem to get.",very short sentence; B contains more information than A; 0 -> Smith said;
56,The other semifinal between Guillermo Coria of Argentina and Martin Verkerk of the Netherlands is also compelling.,"The other, much less likely semifinal will match seventh-seeded Guillermo Coria of Argentina against the unseeded Dutchman Martin Verkerk.",0,"Correct  chunks of first sentence are correct, but the other part changes things (is also compelling vs. much less likely semifinal)...",between -> will match; is also compelling -> 0; B has more detail in the description of the individuals (named entity recognition could help);
